tweet_id,timestamp,source,text,rating_numerator,rating_denominator,name,dog_stages,jpg_url,img_num,p1,p1_confidence,p1_dog,p2,p2_confidence,p2_dog,p3,p3_confidence,p3_dog,retweet_count,favorite_count
892420643555336193,2017-08-01 16:23:56+00:00,"<a href=""http://twitter.com/download/iphone"" rel=""nofollow"">Twitter for iPhone</a>",This is Phineas. He's a mystical boy. Only ever appears in the hole of a donut. 13/10 https://t.co/MgUWQ76dJU,13,10,Phineas,,https://pbs.twimg.com/media/DGKD1-bXoAAIAUK.jpg,1.0,Orange,0.0970486,False,Bagel,0.0858511,False,Banana,0.07611,False,8853.0,39467.0
892177421306343426,2017-08-01 00:17:27+00:00,"<a href=""http://twitter.com/download/iphone"" rel=""nofollow"">Twitter for iPhone</a>","This is Tilly. She's just checking pup on you. Hopes you're doing ok. If not, she's available for pats, snugs, boops, the whole bit. 13/10 https://t.co/0Xxu71qeIV",13,10,Tilly,,https://pbs.twimg.com/media/DGGmoV4XsAAUL6n.jpg,1.0,Chihuahua,0.323581,True,Pekinese,0.0906465,True,Papillon,0.0689569,True,6514.0,33819.0
891815181378084864,2017-07-31 00:18:03+00:00,"<a href=""http://twitter.com/download/iphone"" rel=""nofollow"">Twitter for iPhone</a>",This is Archie. He is a rare Norwegian Pouncing Corgo. Lives in the tall grass. You never know when one may strike. 12/10 https://t.co/wUnZnhtVJB,12,10,Archie,,https://pbs.twimg.com/media/DGBdLU1WsAANxJ9.jpg,1.0,Chihuahua,0.716012,True,Malamute,0.078253,True,Kelpie,0.0313789,True,4328.0,25461.0
891689557279858688,2017-07-30 15:58:51+00:00,"<a href=""http://twitter.com/download/iphone"" rel=""nofollow"">Twitter for iPhone</a>",This is Darla. She commenced a snooze mid meal. 13/10 happens to the best of us https://t.co/tD36da7qLQ,13,10,Darla,,https://pbs.twimg.com/media/DF_q7IAWsAEuuN8.jpg,1.0,Paper_Towel,0.1702779999999999,False,Labrador_Retriever,0.1680859999999999,True,Spatula,0.0408359,False,8964.0,42908.0
891327558926688256,2017-07-29 16:00:24+00:00,"<a href=""http://twitter.com/download/iphone"" rel=""nofollow"">Twitter for iPhone</a>","This is Franklin. He would like you to stop calling him ""cute."" He is a very fierce shark and should be respected as such. 12/10 #BarkWeek https://t.co/AtUZn91f7f",12,10,Franklin,,https://pbs.twimg.com/media/DF6hr6BUMAAzZgT.jpg,2.0,Basset,0.555712,True,English_Springer,0.2257699999999999,True,German_Short-Haired_Pointer,0.175219,True,9774.0,41048.0
891087950875897856,2017-07-29 00:08:17+00:00,"<a href=""http://twitter.com/download/iphone"" rel=""nofollow"">Twitter for iPhone</a>",Here we have a majestic great white breaching off South Africa's coast. Absolutely h*ckin breathtaking. 13/10 (IG: tucker_marlo) #BarkWeek https://t.co/kQ04fDDRmh,13,10,,,https://pbs.twimg.com/media/DF3HwyEWsAABqE6.jpg,1.0,Chesapeake_Bay_Retriever,0.425595,True,Irish_Terrier,0.116317,True,Indian_Elephant,0.0769021999999999,False,3261.0,20562.0
890971913173991426,2017-07-28 16:27:12+00:00,"<a href=""http://twitter.com/download/iphone"" rel=""nofollow"">Twitter for iPhone</a>","Meet Jax. He enjoys ice cream so much he gets nervous around it. 13/10 help Jax enjoy more things by clicking below

https://t.co/Zr4hWfAs1H https://t.co/tVJBRMnhxl",13,10,Jax,,https://pbs.twimg.com/media/DF1eOmZXUAALUcq.jpg,1.0,Appenzeller,0.341703,True,Border_Collie,0.199287,True,Ice_Lolly,0.193548,False,2158.0,12041.0
890729181411237888,2017-07-28 00:22:40+00:00,"<a href=""http://twitter.com/download/iphone"" rel=""nofollow"">Twitter for iPhone</a>",When you watch your owner call another dog a good boy but then they turn back to you and say you're a great boy. 13/10 https://t.co/v0nONBcwxq,13,10,,,https://pbs.twimg.com/media/DFyBahAVwAAhUTd.jpg,2.0,Pomeranian,0.566142,True,Eskimo_Dog,0.1784059999999999,True,Pembroke,0.0765069,True,16716.0,56848.0
890609185150312448,2017-07-27 16:25:51+00:00,"<a href=""http://twitter.com/download/iphone"" rel=""nofollow"">Twitter for iPhone</a>",This is Zoey. She doesn't want to be one of the scary sharks. Just wants to be a snuggly pettable boatpet. 13/10 #BarkWeek https://t.co/9TwLuAGH0b,13,10,Zoey,,https://pbs.twimg.com/media/DFwUU__XcAEpyXI.jpg,1.0,Irish_Terrier,0.4875739999999999,True,Irish_Setter,0.193054,True,Chesapeake_Bay_Retriever,0.118184,True,4429.0,28226.0
890240255349198849,2017-07-26 15:59:51+00:00,"<a href=""http://twitter.com/download/iphone"" rel=""nofollow"">Twitter for iPhone</a>",This is Cassie. She is a college pup. Studying international doggo communication and stick theory. 14/10 so elegant much sophisticate https://t.co/t1bfwz5S2A,14,10,Cassie,doggo,https://pbs.twimg.com/media/DFrEyVuW0AAO3t9.jpg,1.0,Pembroke,0.511319,True,Cardigan,0.451038,True,Chihuahua,0.0292482,True,7711.0,32467.0
890006608113172480,2017-07-26 00:31:25+00:00,"<a href=""http://twitter.com/download/iphone"" rel=""nofollow"">Twitter for iPhone</a>",This is Koda. He is a South Australian deckshark. Deceptively deadly. Frighteningly majestic. 13/10 would risk a petting #BarkWeek https://t.co/dVPW0B0Mme,13,10,Koda,,https://pbs.twimg.com/media/DFnwSY4WAAAMliS.jpg,1.0,Samoyed,0.957979,True,Pomeranian,0.0138835,True,Chow,0.00816748,True,7624.0,31166.0
889880896479866881,2017-07-25 16:11:53+00:00,"<a href=""http://twitter.com/download/iphone"" rel=""nofollow"">Twitter for iPhone</a>",This is Bruno. He is a service shark. Only gets out of the water to assist you. 13/10 terrifyingly good boy https://t.co/u1XPQMl29g,13,10,Bruno,,https://pbs.twimg.com/media/DFl99B1WsAITKsg.jpg,1.0,French_Bulldog,0.377417,True,Labrador_Retriever,0.151317,True,Muzzle,0.0829811,False,5156.0,28268.0
889665388333682689,2017-07-25 01:55:32+00:00,"<a href=""http://twitter.com/download/iphone"" rel=""nofollow"">Twitter for iPhone</a>",Here's a puppo that seems to be on the fence about something haha no but seriously someone help her. 13/10 https://t.co/BxvuXk0UCm,13,10,,puppo,https://pbs.twimg.com/media/DFi579UWsAAatzw.jpg,1.0,Pembroke,0.966327,True,Cardigan,0.0273557,True,Basenji,0.00463323,True,8538.0,38818.0
889638837579907072,2017-07-25 00:10:02+00:00,"<a href=""http://twitter.com/download/iphone"" rel=""nofollow"">Twitter for iPhone</a>",This is Ted. He does his best. Sometimes that's not enough. But it's ok. 12/10 would assist https://t.co/f8dEDcrKSR,12,10,Ted,,https://pbs.twimg.com/media/DFihzFfXsAYGDPR.jpg,1.0,French_Bulldog,0.99165,True,Boxer,0.00212864,True,Staffordshire_Bullterrier,0.00149818,True,4735.0,27672.0
889531135344209921,2017-07-24 17:02:04+00:00,"<a href=""http://twitter.com/download/iphone"" rel=""nofollow"">Twitter for iPhone</a>",This is Stuart. He's sporting his favorite fanny pack. Secretly filled with bones only. 13/10 puppared puppo #BarkWeek https://t.co/y70o6h3isq,13,10,Stuart,puppo,https://pbs.twimg.com/media/DFg_2PVW0AEHN3p.jpg,1.0,Golden_Retriever,0.953442,True,Labrador_Retriever,0.0138341,True,Redbone,0.00795775,True,2321.0,15359.0
889278841981685760,2017-07-24 00:19:32+00:00,"<a href=""http://twitter.com/download/iphone"" rel=""nofollow"">Twitter for iPhone</a>",This is Oliver. You're witnessing one of his many brutal attacks. Seems to be playing with his victim. 13/10 fr*ckin frightening #BarkWeek https://t.co/WpHvrQedPb,13,10,Oliver,,https://pbs.twimg.com/ext_tw_video_thumb/889278779352338437/pu/img/VlbFB3v8H8VwzVNY.jpg,1.0,Whippet,0.626152,True,Borzoi,0.194742,True,Saluki,0.0273507,True,5637.0,25652.0
888917238123831296,2017-07-23 00:22:39+00:00,"<a href=""http://twitter.com/download/iphone"" rel=""nofollow"">Twitter for iPhone</a>",This is Jim. He found a fren. Taught him how to sit like the good boys. 12/10 for both https://t.co/chxruIOUJN,12,10,Jim,,https://pbs.twimg.com/media/DFYRgsOUQAARGhO.jpg,1.0,Golden_Retriever,0.714719,True,Tibetan_Mastiff,0.1201839999999999,True,Labrador_Retriever,0.1055059999999999,True,4709.0,29611.0
888804989199671297,2017-07-22 16:56:37+00:00,"<a href=""http://twitter.com/download/iphone"" rel=""nofollow"">Twitter for iPhone</a>",This is Zeke. He has a new stick. Very proud of it. Would like you to throw it for him without taking it. 13/10 would do my best https://t.co/HTQ77yNQ5K,13,10,Zeke,,https://pbs.twimg.com/media/DFWra-3VYAA2piG.jpg,1.0,Golden_Retriever,0.46976,True,Labrador_Retriever,0.184172,True,English_Setter,0.0734817,True,4559.0,26080.0
888554962724278272,2017-07-22 00:23:06+00:00,"<a href=""http://twitter.com/download/iphone"" rel=""nofollow"">Twitter for iPhone</a>",This is Ralphus. He's powering up. Attempting maximum borkdrive. 13/10 inspirational af https://t.co/YnYAFCTTiK,13,10,Ralphus,,https://pbs.twimg.com/media/DFTH_O-UQAACu20.jpg,3.0,Siberian_Husky,0.700377,True,Eskimo_Dog,0.166511,True,Malamute,0.111411,True,3732.0,20290.0
888078434458587136,2017-07-20 16:49:33+00:00,"<a href=""http://twitter.com/download/iphone"" rel=""nofollow"">Twitter for iPhone</a>",This is Gerald. He was just told he didn't get the job he interviewed for. A h*ckin injustice. 12/10 didn't want the job anyway https://t.co/DK7iDPfuRX,12,10,Gerald,,https://pbs.twimg.com/media/DFMWn56WsAAkA7B.jpg,1.0,French_Bulldog,0.995026,True,Pug,0.000931908,True,Bull_Mastiff,0.000903211,True,3653.0,22201.0
887705289381826560,2017-07-19 16:06:48+00:00,"<a href=""http://twitter.com/download/iphone"" rel=""nofollow"">Twitter for iPhone</a>",This is Jeffrey. He has a monopoly on the pool noodles. Currently running a 'boop for two' midweek sale. 13/10 h*ckin strategic https://t.co/PhrUk20Q64,13,10,Jeffrey,,https://pbs.twimg.com/media/DFHDQBbXgAEqY7t.jpg,1.0,Basset,0.821664,True,Redbone,0.0875815,True,Weimaraner,0.0262364,True,5609.0,30779.0
887517139158093824,2017-07-19 03:39:09+00:00,"<a href=""http://twitter.com/download/iphone"" rel=""nofollow"">Twitter for iPhone</a>",I've yet to rate a Venezuelan Hover Wiener. This is such an honor. 14/10 paw-inspiring af (IG: roxy.thedoxy) https://t.co/20VrLAA8ba,14,10,such,,https://pbs.twimg.com/ext_tw_video_thumb/887517108413886465/pu/img/WanJKwssZj4VJvL9.jpg,1.0,Limousine,0.130432,False,Tow_Truck,0.0291754,False,Shopping_Cart,0.0263208,False,12082.0,46959.0
887473957103951883,2017-07-19 00:47:34+00:00,"<a href=""http://twitter.com/download/iphone"" rel=""nofollow"">Twitter for iPhone</a>",This is Canela. She attempted some fancy porch pics. They were unsuccessful. 13/10 someone help her https://t.co/cLyzpcUcMX,13,10,Canela,,https://pbs.twimg.com/media/DFDw2tyUQAAAFke.jpg,2.0,Pembroke,0.809197,True,Rhodesian_Ridgeback,0.05495,True,Beagle,0.0389148,True,18781.0,69871.0
887343217045368832,2017-07-18 16:08:03+00:00,"<a href=""http://twitter.com/download/iphone"" rel=""nofollow"">Twitter for iPhone</a>",You may not have known you needed to see this today. 13/10 please enjoy (IG: emmylouroo) https://t.co/WZqNqygEyV,13,10,,,https://pbs.twimg.com/ext_tw_video_thumb/887343120832229379/pu/img/6HSuFrW1lzI_9Mht.jpg,1.0,Mexican_Hairless,0.330741,True,Sea_Lion,0.275645,False,Weimaraner,0.134203,True,10737.0,34222.0
887101392804085760,2017-07-18 00:07:08+00:00,"<a href=""http://twitter.com/download/iphone"" rel=""nofollow"">Twitter for iPhone</a>",This... is a Jubilant Antarctic House Bear. We only rate dogs. Please only send dogs. Thank you... 12/10 would suffocate in floof https://t.co/4Ad1jzJSdp,12,10,,,https://pbs.twimg.com/media/DE-eAq6UwAA-jaE.jpg,1.0,Samoyed,0.733942,True,Eskimo_Dog,0.0350295,True,Staffordshire_Bullterrier,0.0297047,True,6167.0,31061.0
886983233522544640,2017-07-17 16:17:36+00:00,"<a href=""http://twitter.com/download/iphone"" rel=""nofollow"">Twitter for iPhone</a>",This is Maya. She's very shy. Rarely leaves her cup. 13/10 would find her an environment to thrive in https://t.co/I6oNy0CgiT,13,10,Maya,,https://pbs.twimg.com/media/DE8yicJW0AAAvBJ.jpg,2.0,Chihuahua,0.793469,True,Toy_Terrier,0.143528,True,Can_Opener,0.0322529,False,8084.0,35859.0
886736880519319552,2017-07-16 23:58:41+00:00,"<a href=""http://twitter.com/download/iphone"" rel=""nofollow"">Twitter for iPhone</a>","This is Mingus. He's a wonderful father to his smol pup. Confirmed 13/10, but he needs your help

https://t.co/bVi0Yr4Cff https://t.co/ISvKOSkd5b",13,10,Mingus,,https://pbs.twimg.com/media/DE5Se8FXcAAJFx4.jpg,1.0,Kuvasz,0.309706,True,Great_Pyrenees,0.186136,True,Dandie_Dinmont,0.0863463,True,3443.0,12306.0
886680336477933568,2017-07-16 20:14:00+00:00,"<a href=""http://twitter.com/download/iphone"" rel=""nofollow"">Twitter for iPhone</a>",This is Derek. He's late for a dog meeting. 13/10 pet...al to the metal https://t.co/BCoWue0abA,13,10,Derek,,https://pbs.twimg.com/media/DE4fEDzWAAAyHMM.jpg,1.0,Convertible,0.738995,False,Sports_Car,0.139952,False,Car_Wheel,0.0441726999999999,False,4610.0,22798.0
886366144734445568,2017-07-15 23:25:31+00:00,"<a href=""http://twitter.com/download/iphone"" rel=""nofollow"">Twitter for iPhone</a>",This is Roscoe. Another pupper fallen victim to spontaneous tongue ejections. Get the BlepiPen immediate. 12/10 deep breaths Roscoe https://t.co/RGE08MIJox,12,10,Roscoe,pupper,https://pbs.twimg.com/media/DE0BTnQUwAApKEH.jpg,1.0,French_Bulldog,0.999201,True,Chihuahua,0.000361178,True,Boston_Bull,7.55616e-05,True,3316.0,21524.0
886258384151887873,2017-07-15 16:17:19+00:00,"<a href=""http://twitter.com/download/iphone"" rel=""nofollow"">Twitter for iPhone</a>",This is Waffles. His doggles are pupside down. Unsure how to fix. 13/10 someone assist Waffles https://t.co/xZDA9Qsq1O,13,10,Waffles,,https://pbs.twimg.com/media/DEyfTG4UMAE4aE9.jpg,1.0,Pug,0.943575,True,Shower_Cap,0.0252856,False,Siamese_Cat,0.00284892,False,6523.0,28469.0
885984800019947520,2017-07-14 22:10:11+00:00,"<a href=""http://twitter.com/download/iphone"" rel=""nofollow"">Twitter for iPhone</a>",Viewer discretion advised. This is Jimbo. He will rip ur finger right h*ckin off. Other dog clearly an accessory. 12/10 pls pet with caution https://t.co/BuveP0uMF1,12,10,Jimbo,,https://pbs.twimg.com/media/DEumeWWV0AA-Z61.jpg,1.0,Blenheim_Spaniel,0.972494,True,Shih-Tzu,0.00663012,True,Bernese_Mountain_Dog,0.00623915,True,7097.0,33382.0
885528943205470208,2017-07-13 15:58:47+00:00,"<a href=""http://twitter.com/download/iphone"" rel=""nofollow"">Twitter for iPhone</a>",This is Maisey. She fell asleep mid-excavation. Happens to the best of us. 13/10 would pat noggin approvingly https://t.co/tp1kQ8i9JF,13,10,Maisey,,https://pbs.twimg.com/media/DEoH3yvXgAAzQtS.jpg,1.0,Pug,0.369275,True,Labrador_Retriever,0.265835,True,Kuvasz,0.134697,True,6683.0,36689.0
885518971528720385,2017-07-13 15:19:09+00:00,"<a href=""http://twitter.com/download/iphone"" rel=""nofollow"">Twitter for iPhone</a>",I have a new hero and his name is Howard. 14/10 https://t.co/gzLHboL7Sk,14,10,,,,,,,,,,,,,,3899.0,20788.0
885167619883638784,2017-07-12 16:03:00+00:00,"<a href=""http://twitter.com/download/iphone"" rel=""nofollow"">Twitter for iPhone</a>",Here we have a corgi undercover as a malamute. Pawbably doing important investigative work. Zero control over tongue happenings. 13/10 https://t.co/44ItaMubBf,13,10,,,https://pbs.twimg.com/media/DEi_N9qXYAAgEEw.jpg,4.0,Malamute,0.8124819999999999,True,Siberian_Husky,0.0717125,True,Eskimo_Dog,0.0557697,True,4556.0,22367.0
884925521741709313,2017-07-12 00:01:00+00:00,"<a href=""http://twitter.com/download/iphone"" rel=""nofollow"">Twitter for iPhone</a>","This is Earl. He found a hat. Nervous about what you think of it. 12/10 it's delightful, Earl https://t.co/MYJvdlNRVa",12,10,Earl,,https://pbs.twimg.com/media/DEfjEaNXkAAtPlj.jpg,1.0,Italian_Greyhound,0.259916,True,American_Staffordshire_Terrier,0.198451,True,Staffordshire_Bullterrier,0.127725,True,16439.0,68152.0
884876753390489601,2017-07-11 20:47:12+00:00,"<a href=""http://twitter.com/download/iphone"" rel=""nofollow"">Twitter for iPhone</a>",This is Lola. It's her first time outside. Must test the earth and taste the atmosphere. 13/10 you're doing great Lola https://t.co/74TKAUsLkO,13,10,Lola,,https://pbs.twimg.com/media/DEe2tZXXkAAwyX3.jpg,1.0,Chow,0.822103,True,Norwich_Terrier,0.106075,True,Norfolk_Terrier,0.0373485,True,6096.0,28514.0
884562892145688576,2017-07-11 00:00:02+00:00,"<a href=""http://twitter.com/download/iphone"" rel=""nofollow"">Twitter for iPhone</a>",This is Kevin. He's just so happy. 13/10 what is your secret Kevin https://t.co/1r4MFCbCX5,13,10,Kevin,,https://pbs.twimg.com/media/DEaZQkfXUAEC7qB.jpg,1.0,Pug,0.5464060000000001,True,French_Bulldog,0.404291,True,Brabancon_Griffon,0.0440019,True,5100.0,24765.0
884441805382717440,2017-07-10 15:58:53+00:00,"<a href=""http://twitter.com/download/iphone"" rel=""nofollow"">Twitter for iPhone</a>","I present to you, Pup in Hat. Pup in Hat is great for all occasions. Extremely versatile. Compact as h*ck. 14/10 (IG: itselizabethgales) https://t.co/vvBOcC2VdC",14,10,,,https://pbs.twimg.com/media/DEYrIZwWsAA2Wo5.jpg,1.0,Pembroke,0.993225,True,Cardigan,0.00321648,True,Chihuahua,0.00208089,True,5856.0,27478.0
884247878851493888,2017-07-10 03:08:17+00:00,"<a href=""http://twitter.com/download/iphone"" rel=""nofollow"">Twitter for iPhone</a>",OMG HE DIDN'T MEAN TO HE WAS JUST TRYING A LITTLE BARKOUR HE'S SUPER SORRY 13/10 WOULD FORGIVE IMMEDIATE https://t.co/uF3pQ8Wubj,13,10,,,,,,,,,,,,,,21298.0,74423.0
884162670584377345,2017-07-09 21:29:42+00:00,"<a href=""http://twitter.com/download/iphone"" rel=""nofollow"">Twitter for iPhone</a>",Meet Yogi. He doesn't have any important dog meetings today he just enjoys looking his best at all times. 12/10 for dangerously dapper doggo https://t.co/YSI00BzTBZ,12,10,Yogi,doggo,https://pbs.twimg.com/media/DEUtQbzW0AUTv_o.jpg,1.0,German_Shepherd,0.707046,True,Malinois,0.199396,True,Norwegian_Elkhound,0.0491476,True,3128.0,20771.0
883838122936631299,2017-07-09 00:00:04+00:00,"<a href=""http://twitter.com/download/iphone"" rel=""nofollow"">Twitter for iPhone</a>",This is Noah. He can't believe someone made this mess. Got the vacuum out for you though. Offered to help clean pup. 12/10 super good boy https://t.co/V85xujjDDY,12,10,Noah,,https://pbs.twimg.com/media/DEQGFgAXUAAEvfi.jpg,1.0,Doberman,0.610946,True,Miniature_Pinscher,0.299603,True,Kelpie,0.0630203,True,3586.0,22349.0
883482846933004288,2017-07-08 00:28:19+00:00,"<a href=""http://twitter.com/download/iphone"" rel=""nofollow"">Twitter for iPhone</a>","This is Bella. She hopes her smile made you smile. If not, she is also offering you her favorite monkey. 13.5/10 https://t.co/qjrljjt948",15,10,Bella,,https://pbs.twimg.com/media/DELC9dZXUAADqUk.jpg,1.0,Golden_Retriever,0.943082,True,Labrador_Retriever,0.032409,True,Kuvasz,0.00550072,True,10407.0,46860.0
883360690899218434,2017-07-07 16:22:55+00:00,"<a href=""http://twitter.com/download/iphone"" rel=""nofollow"">Twitter for iPhone</a>",Meet Grizzwald. He may be the floofiest floofer I ever did see. Lost eyes saving a schoolbus from a volcano erpuption. 13/10 heroic as h*ck https://t.co/rf661IFEYP,13,10,Grizzwald,floofer,https://pbs.twimg.com/media/DEJT3FeXoAAtwUy.jpg,1.0,Chow,0.987997,True,Tibetan_Mastiff,0.00709872,True,Newfoundland,0.00214033,True,3825.0,22986.0
883117836046086144,2017-07-07 00:17:54+00:00,"<a href=""http://twitter.com/download/iphone"" rel=""nofollow"">Twitter for iPhone</a>","Please only send dogs. We don't rate mechanics, no matter how h*ckin good. Thank you... 13/10 would sneak a pat https://t.co/Se5fZ9wp5E",13,10,,,https://pbs.twimg.com/media/DEF2-_hXoAAs62q.jpg,2.0,Golden_Retriever,0.949562,True,Labrador_Retriever,0.0459479,True,Kuvasz,0.00247094,True,6949.0,37914.0
882992080364220416,2017-07-06 15:58:11+00:00,"<a href=""http://twitter.com/download/iphone"" rel=""nofollow"">Twitter for iPhone</a>",This is Rusty. He wasn't ready for the first pic. Clearly puppared for the second. 13/10 confirmed great boy https://t.co/tyER0KpdXj,13,10,Rusty,,https://pbs.twimg.com/media/DEEEnIqXYAAiJh_.jpg,1.0,Eskimo_Dog,0.4667779999999999,True,Siberian_Husky,0.406044,True,Dingo,0.0734143999999999,False,4122.0,24445.0
882762694511734784,2017-07-06 00:46:41+00:00,"<a href=""http://twitter.com/download/iphone"" rel=""nofollow"">Twitter for iPhone</a>",This is Gus. He's quite the cheeky pupper. Already perfected the disinterested wink. 12/10 would let steal my girl https://t.co/D43I96SlVu,12,10,Gus,pupper,https://pbs.twimg.com/media/DEAz_HHXsAA-p_z.jpg,1.0,Labrador_Retriever,0.85005,True,Chesapeake_Bay_Retriever,0.074257,True,Flat-Coated_Retriever,0.0155793999999999,True,5134.0,28903.0
882627270321602560,2017-07-05 15:48:34+00:00,"<a href=""http://twitter.com/download/iphone"" rel=""nofollow"">Twitter for iPhone</a>",This is Stanley. He has his first swim lesson today. Doggle straps adjusted. Ready to go. 13/10 Phelps is nervous (IG: stanleythe_corgi) https://t.co/Nx52PGwH94,13,10,Stanley,,https://pbs.twimg.com/media/DD-40X3WAAAJPU5.jpg,1.0,Pembroke,0.542982,True,Chihuahua,0.251988,True,Cardigan,0.107699,True,6342.0,28382.0
882268110199369728,2017-07-04 16:01:23+00:00,"<a href=""http://twitter.com/download/iphone"" rel=""nofollow"">Twitter for iPhone</a>",This is Alfy. You're witnessing his first watermelon experience. I think it was a success. 13/10 happy 4th Alfy ðŸ‡ºðŸ‡¸ https://t.co/fYP5RlutfA,13,10,Alfy,,https://pbs.twimg.com/media/DD5yKdPW0AArzX8.jpg,1.0,Golden_Retriever,0.762211,True,Labrador_Retriever,0.0989848999999999,True,Cocker_Spaniel,0.0171995,True,12118.0,45880.0
882045870035918850,2017-07-04 01:18:17+00:00,"<a href=""http://twitter.com/download/iphone"" rel=""nofollow"">Twitter for iPhone</a>","This is Koko. Her owner, inspired by Barney, recently built a cart for her to use during walks if she got tired. 13/10 rest easy Koko https://t.co/zeDpnsKX7w",13,10,Koko,,https://pbs.twimg.com/media/DD2oCl2WAAEI_4a.jpg,1.0,Web_Site,0.949591,False,Dhole,0.0173258,False,Golden_Retriever,0.00694063,True,5203.0,29900.0
881906580714921986,2017-07-03 16:04:48+00:00,"<a href=""http://twitter.com/download/iphone"" rel=""nofollow"">Twitter for iPhone</a>",This is Rey. He's a Benebop Cumberfloof. 12/10 dangerously pettable https://t.co/503CgWbhxQ,12,10,Rey,,https://pbs.twimg.com/media/DD0pWm9XcAAeSBL.jpg,1.0,Weimaraner,0.291539,True,Chesapeake_Bay_Retriever,0.278966,True,Koala,0.127017,False,3533.0,24773.0
881666595344535552,2017-07-03 00:11:11+00:00,"<a href=""http://twitter.com/download/iphone"" rel=""nofollow"">Twitter for iPhone</a>",This is Gary. He couldn't miss this puppertunity for a selfie. Flawless focusing skills. 13/10 would boop intensely https://t.co/7CSWCl8I6s,13,10,Gary,,https://pbs.twimg.com/media/DDxPFwbWAAEbVVR.jpg,1.0,Saluki,0.529012,True,Afghan_Hound,0.250003,True,Golden_Retriever,0.160739,True,11099.0,51522.0
881536004380872706,2017-07-02 15:32:16+00:00,"<a href=""http://twitter.com/download/iphone"" rel=""nofollow"">Twitter for iPhone</a>","Here is a pupper approaching maximum borkdrive. Zooming at never before seen speeds. 14/10 paw-inspiring af 
(IG: puffie_the_chow) https://t.co/ghXBIIeQZF",14,10,a,pupper,https://pbs.twimg.com/ext_tw_video_thumb/881535971568889856/pu/img/9bawiZ--8FKywTkz.jpg,1.0,Samoyed,0.281463,True,Angora,0.272066,False,Persian_Cat,0.114854,False,16570.0,50199.0
881268444196462592,2017-07-01 21:49:04+00:00,"<a href=""http://twitter.com/download/iphone"" rel=""nofollow"">Twitter for iPhone</a>",Meet Elliot. He's a Canadian Forrest Pup. Unusual number of antlers for a dog. Sneaky tongue slip to celebrate #Canada150. 12/10 would pet https://t.co/cgwJwowTMC,12,10,Elliot,,https://pbs.twimg.com/media/DDrk-f9WAAI-WQv.jpg,1.0,Tusker,0.473303,False,Indian_Elephant,0.245646,False,Ibex,0.0556607,False,5358.0,23501.0
880935762899988482,2017-06-30 23:47:07+00:00,"<a href=""http://twitter.com/download/iphone"" rel=""nofollow"">Twitter for iPhone</a>",This is Louis. He's crossing. It's a big deal. 13/10 h*ckin breathtaking https://t.co/D0wb1GlKAt,13,10,Louis,,https://pbs.twimg.com/media/DDm2Z5aXUAEDS2u.jpg,1.0,Street_Sign,0.251801,False,Umbrella,0.115123,False,Traffic_Light,0.0695338,False,2886.0,17346.0
880872448815771648,2017-06-30 19:35:32+00:00,"<a href=""http://twitter.com/download/iphone"" rel=""nofollow"">Twitter for iPhone</a>",Ugh not again. We only rate dogs. Please don't send in well-dressed  floppy-tongued street penguins. Dogs only please. Thank you... 12/10 https://t.co/WiAMbTkDPf,12,10,,,https://pbs.twimg.com/media/DDl8zzJW0AAisCJ.jpg,1.0,Pembroke,0.791416,True,Norwich_Terrier,0.0613929,True,Chihuahua,0.0337257,True,3989.0,21734.0
880465832366813184,2017-06-29 16:39:47+00:00,"<a href=""http://twitter.com/download/iphone"" rel=""nofollow"">Twitter for iPhone</a>",This is Bella. She had her first beach experience this morning. Complete success. 12/10 would perform a sandy boop https://t.co/4VsFysDmiw,12,10,Bella,,https://pbs.twimg.com/media/DDgK-J4XUAIEV9W.jpg,1.0,Golden_Retriever,0.913255,True,Labrador_Retriever,0.0263286,True,Cocker_Spaniel,0.00937082,True,6546.0,29075.0
880221127280381952,2017-06-29 00:27:25+00:00,"<a href=""http://twitter.com/download/iphone"" rel=""nofollow"">Twitter for iPhone</a>",Meet Jesse. He's a Fetty Woof. His tongue ejects without warning. A true bleptomaniac. 12/10 would snug well https://t.co/fUod0tVmvK,12,10,Jesse,,https://pbs.twimg.com/media/DDcscbXU0AIfDzs.jpg,1.0,Chihuahua,0.238525,True,Meerkat,0.104256,False,Clumber,0.0525802999999999,True,4436.0,27640.0
880095782870896641,2017-06-28 16:09:20+00:00,"<a href=""http://twitter.com/download/iphone"" rel=""nofollow"">Twitter for iPhone</a>",Please don't send in photos without dogs in them. We're not @porch_rates. Insubordinate and churlish. Pretty good porch tho 11/10 https://t.co/HauE8M3Bu4,11,10,,,https://pbs.twimg.com/media/DDa6ckbXgAAM1vV.jpg,1.0,Miniature_Pinscher,0.120298,True,Rhodesian_Ridgeback,0.106395,True,Beagle,0.106073,True,4533.0,28150.0
879862464715927552,2017-06-28 00:42:13+00:00,"<a href=""http://twitter.com/download/iphone"" rel=""nofollow"">Twitter for iPhone</a>",This is Romeo. He would like to do an entrance. Requesting your immediate assistance. 13/10 https://t.co/Qh5aEkRQm9,13,10,Romeo,,https://pbs.twimg.com/media/DDXmPrbWAAEKMvy.jpg,3.0,Basset,0.813507,True,Beagle,0.146654,True,Cocker_Spaniel,0.00948502,True,3642.0,22667.0
